GIORNO;PRIMO PIATTO;SECONDO PIATTO;CONTORNO;PANE e DESSERT;ALTERNATIVA PRIMO;ALTERNATIVA SECONDO;ALTERNATIVA SECONDO + CONTORNO
LUNEDI`;o PASTA AGLIO, OLIO E PEPERONCINOo MINESTRA DI VERDUREo BIANCO/AL PASTA/RISO POMODORO IN;o PORCHETTAo POLPETTE DI RICOTTA;o CAROTEo SPINACI*o INSALATA MISTA;o PANEo PANE INTEG.o GRISSINIo o BUDINO FRUTTAo YOGURT;oo FORMAGGIO YOGURT A SCELTAo CONTORNOo FRUTTA FRESCAo DESSERT CONFEZIONATO ;oo AFFETTATO FORMAGGIO Gr.o FRUTTO + DESSERT CONFEZIONATOo FRUTTO + YOGURT;INSALATA DI VERDURE MISTE + (una a scelta):o TONNOo o UOVA MOZZARELLA
MARTEDI`;o LASAGNE SPEK E ASPARAGIo PASSATO DI VERDUREo PASTA/RISO IN BIANCO/AL POMODORO;o SPEZZATINO DI MAIALEo PEPERONI E TONNO;o MELANZANEo PATATEo INSALATA MISTA;o PANEo PANE INTEG.o GRISSINIo o FRUTTA BUDINOo YOGURT;o FORMAGGIO A SCELTAo YOGURTo CONTORNOo FRUTTA FRESCAo DESSERT CONFEZIONATO ;o FORMAGGIOo AFFETTATOo FRUTTO + DESSERT CONFEZIONATOo FRUTTO + YOGURT;INSALATA DI VERDURE MISTE + (una a scelta):o TONNOo UOVA MOZZARELLA
MERCOLEDI`;o INSALATA DI RISOo CREMA DI ASPARAGIo PASTA/RISO IN BIANCO/AL POMODORO;o ROLATA DI TACCHINOo CAPRESE;o BIETE*o ZUCCHINEo INSALATA MISTA;o PANEo PANE INTEG.o GRISSINIo FRUTTAo BUDINOo YOGURT;o FORMAGGIO A SCELTAo YOGURTo CONTORNOo FRUTTA FRESCAo DESSERT CONFEZIONATO ;o FORMAGGIOo AFFETTATOo FRUTTO + DESSERT CONFEZIONATOo FRUTTO + YOGURT;INSALATA DI VERDURE MISTE + (una a scelta):o TONNOo MOZZARELLA UOVA
GIOVEDI`;o TAGLIATELLE ASPARAGI E SALSICCIAo ZUPPA DI CEREALIo PASTA INTEGRALE/RISO IN BIANCO/AL POMODORO;o LINGUA AL VERDEo MELANZANE ALLA PIZZAIOLA;o FAGIOLINI*o VERDURE BOLLITE IN INSALATAo INSALATA MISTA;o PANEo PANE INTEG.o GRISSINIo FRUTTAo BUDINOo YOGURT;o FORMAGGIO A SCELTAo YOGURTo CONTORNOo FRUTTA FRESCAo DESSERT CONFEZIONATO ;o FORMAGGIOo AFFETTATOo FRUTTO + DESSERT CONFEZIONATOo FRUTTO + YOGURT;INSALATA DI VERDURE MISTE + (una a scelta):o TONNOo UOVAo MOZZARELLA
VENERDI`;o PIZZAo VELLUTATA DI ZUCCHINEo PASTA/RISO IN BIANCO/AL POMODORO;o PESCE*o ROTOLO DI FRITTATA;o PEPERONIo FINOCCHIo INSALATA MISTA;o PANEo PANE INTEG.o GRISSINIo o FRUTTA BUDINOo YOGURT;o FORMAGGIO A SCELTAo YOGURTo CONTORNOo FRUTTA FRESCAo DESSERT CONFEZIONATO ;o FORMAGGIOo AFFETTATOo FRUTTO + DESSERT CONFEZIONATOo FRUTTO + YOGURT;INSALATA DI VERDURE MISTE + (una a scelta):o TONNOo o UOVA MOZZARELLA
